{
  "anchor_sample": 4800,
  "bits_per_sample": 16,
  "channels": 1,
  "chirps": [
    {
      "end_hz": 8000,
      "end_sample": 13440,
      "fade_samples": 480,
      "start_hz": 500,
      "start_sample": 4800
    },
    {
      "end_hz": 8000,
      "end_sample": 29280,
      "fade_samples": 480,
      "start_hz": 500,
      "start_sample": 20640
    },
    {
      "end_hz": 8000,
      "end_sample": 49920,
      "fade_samples": 480,
      "start_hz": 500,
      "start_sample": 41280
    }
  ],
  "gap_intervals": [
    [
      13440,
      20640
    ],
    [
      29280,
      41280
    ]
  ],
  "lead_silence_samples": 4800,
  "marker_name": "cand-a",
  "marker_semantics_version": 1,
  "page": {
    "filename": "dnd-audio-sync-marker-cand-a.html",
    "sha256": "8c152451387f7833cd758c17a7868ffda2da9208a3581104eb3e4d06261047ce",
    "size_bytes": 152300
  },
  "peak_amplitude": 16384,
  "rationale": "The charter's provisional design: three rising 500 Hz - 8 kHz sweeps. The reference point every other candidate is measured against.",
  "sample_format": "pcm_s16le",
  "sample_rate": 48000,
  "schema_version": 1,
  "total_samples": 54720,
  "trail_silence_samples": 4800,
  "wav": {
    "filename": "dnd-audio-sync-marker-cand-a.wav",
    "sha256": "64d9d114919f2fb65ef348c70e2344456a88f56a15f9822d51c06359c7506842",
    "size_bytes": 109484
  }
}
