{
  "anchor_sample": 4800,
  "bits_per_sample": 16,
  "channels": 1,
  "chirps": [
    {
      "end_hz": 10000,
      "end_sample": 10560,
      "fade_samples": 480,
      "start_hz": 400,
      "start_sample": 4800
    },
    {
      "end_hz": 400,
      "end_sample": 20640,
      "fade_samples": 480,
      "start_hz": 10000,
      "start_sample": 14880
    },
    {
      "end_hz": 10000,
      "end_sample": 34080,
      "fade_samples": 480,
      "start_hz": 400,
      "start_sample": 28320
    }
  ],
  "gap_intervals": [
    [
      10560,
      14880
    ],
    [
      20640,
      28320
    ]
  ],
  "lead_silence_samples": 4800,
  "marker_name": "cand-c",
  "marker_semantics_version": 1,
  "page": {
    "filename": "dnd-audio-sync-marker-cand-c.html",
    "sha256": "c2fe355e17d39a959dd9525b1f8a8106eaad27801b413cb31749eb11686be988",
    "size_bytes": 110197
  },
  "peak_amplitude": 16384,
  "rationale": "Wider band, shorter sweeps, and alternating direction. Asks two questions at once: whether a short chirp survives room reverberation, and whether direction asymmetry buys rejection that gap asymmetry alone does not. The least audible interruption of the three if it works.",
  "sample_format": "pcm_s16le",
  "sample_rate": 48000,
  "schema_version": 1,
  "total_samples": 38880,
  "trail_silence_samples": 4800,
  "wav": {
    "filename": "dnd-audio-sync-marker-cand-c.wav",
    "sha256": "32eef1362f2efdadb0bc7e4116bbf6feaa6d52c990af457b32644cf3055d4d69",
    "size_bytes": 77804
  }
}
